[
  {
    "x": 150,
    "y": 280,
    "w": 16,
    "h": 16,
    "score": 0.97
  },
  {
    "x": 200,
    "y": 300,
    "w": 17,
    "h": 17,
    "score": 0.95
  },
  {
    "x": 240,
    "y": 350,
    "w": 16,
    "h": 16,
    "score": 0.93
  },
  {
    "x": 300,
    "y": 290,
    "w": 22,
    "h": 12,
    "score": 0.89
  },
  {
    "x": 330,
    "y": 330,
    "w": 16,
    "h": 16,
    "score": 0.96
  },
  {
    "x": 290,
    "y": 360,
    "w": 16,
    "h": 16,
    "score": 0.92
  },
  {
    "x": 400,
    "y": 384,
    "w": 16,
    "h": 16,
    "score": 0.9
  }
]
